participant_name,program_name,rating,comments,submitted_date
Aarav Sharma,Python Basics,5,Excellent course with clear explanations and practical examples.,2024-01-05
Priya Nair,Data Science Fundamentals,4,Very informative. Could use more hands-on exercises.,2024-01-06
Rohan Mehta,Web Development Bootcamp,3,Good content but pacing was too fast for beginners.,2024-01-07
Ananya Iyer,Machine Learning Advanced,5,Outstanding program. The projects were very challenging and rewarding.,2024-01-08
Karthik Reddy,Python Basics,2,Too basic for intermediate learners. Needs advanced modules.,2024-01-09
Sneha Pillai,Data Science Fundamentals,4,Great curriculum. The capstone project was very helpful.,2024-01-10
Vikram Singh,Web Development Bootcamp,5,Best bootcamp I have attended. Instructors were very knowledgeable.,2024-01-11
Meera Krishnan,Machine Learning Advanced,4,Challenging but rewarding. Great peer learning opportunities.,2024-01-12
Arjun Patel,Python Basics,3,Decent introduction. More examples needed for complex topics.,2024-01-13
Divya Menon,Data Science Fundamentals,5,Loved every session. Will definitely recommend to colleagues.,2024-01-14
Suresh Kumar,Web Development Bootcamp,4,Very practical approach. Learned a lot about real-world projects.,2024-01-15
Pooja Verma,Machine Learning Advanced,5,Exceptional depth of content. The instructors are world class.,2024-01-16
Rahul Gupta,Python Basics,4,Good pace and well structured. Enjoyed the interactive sessions.,2024-01-17
Lakshmi Rao,Data Science Fundamentals,3,Average experience. Expected more advanced statistical topics.,2024-01-18
Nikhil Joshi,Web Development Bootcamp,5,Amazing experience. Got a job offer right after completing this.,2024-01-19
Kavya Shetty,Machine Learning Advanced,4,Loved the neural network modules. Very practical implementation.,2024-01-20
Aditya Nair,Python Basics,5,Perfect for beginners. Very patient instructors.,2024-01-21
Sruthi Suresh,Data Science Fundamentals,4,Good balance of theory and practice. Enjoyed the group projects.,2024-01-22
Manoj Kumar,Web Development Bootcamp,2,Expected more focus on backend technologies.,2024-01-23
Roshni Thomas,Machine Learning Advanced,5,Best ML course available. Very comprehensive and up to date.,2024-01-24
Deepak Pillai,Python Basics,4,Clear explanations. The coding challenges were very helpful.,2024-01-25
Anjali Singh,Data Science Fundamentals,5,Exceeded expectations. Learned so much in a short period.,2024-01-26
Vishal Sharma,Web Development Bootcamp,3,Good frontend content but backend needs improvement.,2024-01-27
Nandini Reddy,Machine Learning Advanced,4,Very well structured. Loved the case studies.,2024-01-28
Sameer Patel,Python Basics,5,Great course for beginners. Very supportive community.,2024-01-29
Shalini Krishnan,Data Science Fundamentals,4,Fantastic program. The mentors were very helpful.,2024-01-30
Gaurav Menon,Web Development Bootcamp,5,Incredible learning experience. Built three full-stack apps.,2024-02-01
Poonam Gupta,Machine Learning Advanced,3,Good content but too theoretically heavy. Needs more coding.,2024-02-02
Ajay Nair,Python Basics,4,Solid foundation course. The projects were very well designed.,2024-02-03
Harini Iyer,Data Science Fundamentals,5,Absolutely loved this program. Very practical and job-ready.,2024-02-04
Praveen Kumar,Web Development Bootcamp,4,Very comprehensive. Loved the agile development modules.,2024-02-05
Soundarya Pillai,Machine Learning Advanced,5,Outstanding. The research paper review sessions were invaluable.,2024-02-06
Kiran Verma,Python Basics,3,Basic course. Good for absolute beginners but nothing advanced.,2024-02-07
Ramya Singh,Data Science Fundamentals,4,Well organized curriculum. The instructors are very experienced.,2024-02-08
Siddharth Joshi,Web Development Bootcamp,5,Life-changing program. Got placed in a top tech company.,2024-02-09
Archana Sharma,Machine Learning Advanced,4,Very technical and rigorous. Loved the hands-on labs.,2024-02-10
Naveen Reddy,Python Basics,5,Amazing course structure. The community support is excellent.,2024-02-11
Shwetha Patel,Data Science Fundamentals,3,Decent but could cover more Python libraries for data science.,2024-02-12
Balaji Nair,Web Development Bootcamp,4,Good curriculum. The projects helped build a strong portfolio.,2024-02-13
Lavanya Krishnan,Machine Learning Advanced,5,Best technical program I have ever done. Highly recommended.,2024-02-14
Mohan Gupta,Python Basics,4,Clear and concise. Perfect stepping stone for data science.,2024-02-15
Chandrika Menon,Data Science Fundamentals,5,Outstanding program. The live sessions were very engaging.,2024-02-16
Rajesh Thomas,Web Development Bootcamp,3,Average experience. More real-world project examples needed.,2024-02-17
Usha Pillai,Machine Learning Advanced,4,Great content. The GPU labs were a fantastic addition.,2024-02-18
Amit Kumar,Python Basics,5,Perfect course for beginners. Very interactive and fun.,2024-02-19
Padma Verma,Data Science Fundamentals,4,Well structured and practical. Loved the weekly assignments.,2024-02-20
Suraj Singh,Web Development Bootcamp,5,Excellent bootcamp. The instructors are industry professionals.,2024-02-21
Gayathri Reddy,Machine Learning Advanced,4,Very comprehensive. The capstone project was challenging.,2024-02-22
Dinesh Patel,Python Basics,3,Good basics coverage. Would like more advanced problem sets.,2024-02-23
Sindhu Sharma,Data Science Fundamentals,5,Fantastic experience. The alumni network is very strong.,2024-02-24
Vijay Nair,Web Development Bootcamp,4,Great practical approach. Built a complete e-commerce site.,2024-02-25
Kavitha Iyer,Machine Learning Advanced,5,Exceptional program. The professors have real industry experience.,2024-02-26
Subramaniam Pillai,Python Basics,4,Very good course. The step-by-step approach was very helpful.,2024-02-27
Rekha Singh,Data Science Fundamentals,3,Okay experience. The pace was too slow for advanced learners.,2024-02-28
Gopal Kumar,Web Development Bootcamp,5,Amazing program. The job placement support is top notch.,2024-03-01
Mythili Reddy,Machine Learning Advanced,4,Rigorous and rewarding. The study groups were very helpful.,2024-03-02
Venkat Patel,Python Basics,5,Loved the course. Very engaging and well structured content.,2024-03-03
Aaradhya Nair,Data Science Fundamentals,4,Very practical. The projects made the concepts clear and easy.,2024-03-04
Ravi Krishnan,Web Development Bootcamp,3,Decent bootcamp. Expected more focus on mobile development.,2024-03-05
Kamala Gupta,Machine Learning Advanced,5,World class program. The research methodology was outstanding.,2024-03-06
Prasad Thomas,Python Basics,4,Good beginner course. The mentors were very encouraging.,2024-03-07
Seetha Pillai,Data Science Fundamentals,5,Absolutely fantastic. The data visualization modules were great.,2024-03-08
Mani Verma,Web Development Bootcamp,4,Solid bootcamp. The pair programming sessions were very useful.,2024-03-09
Bharat Singh,Machine Learning Advanced,4,Excellent depth. The TensorFlow labs were very hands-on.,2024-03-10
Nirmala Reddy,Python Basics,5,Great experience. The instructors are very knowledgeable.,2024-03-11
Santosh Patel,Data Science Fundamentals,3,Average program. Needs more focus on deep learning topics.,2024-03-12
Janaki Sharma,Web Development Bootcamp,5,Life changing experience. The curriculum is very industry aligned.,2024-03-13
Latha Nair,Machine Learning Advanced,4,Very challenging and engaging. The peer reviews were insightful.,2024-03-14
Chandra Iyer,Python Basics,4,Well paced course. The quizzes helped reinforce the concepts.,2024-03-15
Mala Pillai,Data Science Fundamentals,5,Amazing program. The instructors make complex topics very simple.,2024-03-16
Arvind Kumar,Web Development Bootcamp,4,Very good curriculum. Learned React and Node.js together.,2024-03-17
Suganya Singh,Machine Learning Advanced,5,Exceptional learning experience. The case studies were superb.,2024-03-18
Sasi Reddy,Python Basics,3,Basic course. Good for freshers but limited scope for growth.,2024-03-19
Muthulakshmi Patel,Data Science Fundamentals,4,Great experience. The live coding sessions were very helpful.,2024-03-20
Krishnamurthy Nair,Web Development Bootcamp,5,Excellent program. The hackathon at the end was very exciting.,2024-03-21
Saranya Krishnan,Machine Learning Advanced,4,Great course content. Loved the feature engineering modules.,2024-03-22
Vignesh Gupta,Python Basics,5,Perfect introduction to Python. Very beginner friendly.,2024-03-23
Thenmozhi Thomas,Data Science Fundamentals,4,Good structured program. The Tableau sessions were excellent.,2024-03-24
Muthu Pillai,Web Development Bootcamp,3,Good basics. Needs more advanced JavaScript framework coverage.,2024-03-25
Elavarasan Verma,Machine Learning Advanced,5,Brilliant program. The model deployment module was very useful.,2024-03-26
Sivakami Singh,Python Basics,4,Very helpful course. The practice problems were excellent.,2024-03-27
Parimala Reddy,Data Science Fundamentals,5,Outstanding curriculum. The final project was very professional.,2024-03-28
Selvam Patel,Web Development Bootcamp,4,Great bootcamp. The CI CD pipeline module was very practical.,2024-03-29
Kousalya Sharma,Machine Learning Advanced,4,Wonderful experience. The explainability AI module was unique.,2024-03-30
Murugesh Nair,Python Basics,5,Excellent course. The object-oriented programming section was clear.,2024-04-01
Geetha Iyer,Data Science Fundamentals,3,Decent program. More real-world datasets would have been better.,2024-04-02
Pandian Pillai,Web Development Bootcamp,5,Incredible bootcamp. Got industry-ready skills in three months.,2024-04-03
Vijayalakshmi Kumar,Machine Learning Advanced,4,Very comprehensive. The natural language processing section was great.,2024-04-04
Natarajan Singh,Python Basics,4,Well organized course. The file handling section was very useful.,2024-04-05
Rajeswari Reddy,Data Science Fundamentals,5,Loved this program. The statistics refresher was very helpful.,2024-04-06
Subramanian Patel,Web Development Bootcamp,4,Good program. The REST API module was very practical and clear.,2024-04-07
Meenakshi Sharma,Machine Learning Advanced,5,Absolutely outstanding. The computer vision module was exceptional.,2024-04-08
Durai Nair,Python Basics,3,Average course. More practice problems would improve the program.,2024-04-09
Saraswathi Krishnan,Data Science Fundamentals,4,Good curriculum. The Power BI integration module was excellent.,2024-04-10
Murugesan Gupta,Web Development Bootcamp,5,Best bootcamp experience. The Docker module was very practical.,2024-04-11
Jayalakshmi Thomas,Machine Learning Advanced,4,Rigorous and rewarding. The reinforcement learning part was amazing.,2024-04-12
Annamalai Pillai,Python Basics,5,Fantastic course. The error handling section was very well taught.,2024-04-13
Kamakshi Verma,Data Science Fundamentals,4,Very good program. The clustering algorithms section was clear.,2024-04-14
Shanmugam Singh,Web Development Bootcamp,4,Solid bootcamp. The GraphQL integration was a great addition.,2024-04-15
Vasantha Reddy,Machine Learning Advanced,5,Superb program. The time series forecasting module was outstanding.,2024-04-16
Srinivasan Patel,Python Basics,4,Good course structure. The lambda functions section was very clear.,2024-04-17
Ambujam Sharma,Data Science Fundamentals,3,Okay program. The SQL integration could have been more detailed.,2024-04-18
Marimuthu Nair,Web Development Bootcamp,5,Great bootcamp. The microservices architecture module was superb.,2024-04-19
Rajamani Iyer,Machine Learning Advanced,4,Great content. The anomaly detection module was very practical.,2024-04-20
INVALID_NAME,,6,This record has invalid rating and missing program.,2024-04-21
,Data Science Fundamentals,4,Missing participant name record for testing.,2024-04-22
Aarav Sharma,Python Basics,5,Excellent course with clear explanations and practical examples.,2024-01-05
Priya Nair,Data Science Fundamentals,4,Very informative. Could use more hands-on exercises.,2024-01-06
